### DISCUSSION TITLE
Libratone documentation

### DISCUSSION THREAD

**Discussion by ndx1905-github** [coffeegreg/YTuner#68] [Tips]
Specific Libratone documentation (tested with Libratone ZIPP)

1/ Install ytuner (release 1.2.6 and up only for Libratone) as per regular instructions.

2/ make sure debug mode is on, ie check your ytuner.ini file in the [Configuration] section, you should have MessageInfoLevel=4
While you're there, go to the [MyStations] section and set Enable=0, and do the same in the [Radiobrowser] section, Enable=0
Remember to set `Enable=1` and `CommonBookmark=0` in `[Bookmark]` section  and `Enable=1` in `[DNSServer]` section too.

3/ run ytuner 

4/ look at the console, you should see something like
```
31-1-25 18:04:44 : Inf : Starting services...
31-1-25 18:04:44 : Inf : DNS Service: listening on: 192.168.1.145:53.
31-1-25 18:04:44 : Inf : Web Service: listening on: 192.168.1.145:80.
```

5/ Look for the ip address of the server that, in the example 192.168.1.145

6/ connect to your Libratone directly through the web interface using your browser and go to the advanced settings  and enter the above ip address in the DNS part
If your Libratone does not save this setting, you have to find a work around and have your router catch the traffic that your speaker intends to send to vtuner.com. To do so you need to know a bit about dsnmasq and your router features. If like me you use openwrt, go to the Network > DNS and DHCP section, and stay in the general tab there. Look for "Addresses" and add this in the field next to it : " /.vtuner.com/192.168.1.145 " (don't forget the first dot which is akin to * to include all subdomains and change the ip address by the one you saw above in 4/ for your config)

Save and apply, or even reboot

7/ run ytuner again, and look at the console like before. While doing this, push the favorite buttons on your Libratone, until you can see logs for each 5 favorites. It should look like this but with different numbers at the end of the lines. Those are the numbers you want to write down for later.  So for me in this example I’ll write down 3251, 5177, 1307, 3252 and 83158.
```
31-1-25 17:20:00 : Dbg : GET /setupapp/company/asp/Browsexpa/Search.asp?sSearchtype=3&search=3251.
31-1-25 17:20:12 : Dbg : GET /setupapp/company/asp/Browsexpa/Search.asp?sSearchtype=3&search=5177.
31-1-25 17:20:19 : Dbg : GET /setupapp/company/asp/Browsexpa/Search.asp?sSearchtype=3&search=1307.
31-1-25 17:20:26 : Dbg : GET /setupapp/company/asp/Browsexpa/Search.asp?sSearchtype=3&search=3252.
31-1-25 17:20:33 : Dbg : GET /setupapp/company/asp/Browsexpa/Search.asp?sSearchtype=3&search=83158.
```

8/ stop ytuner and go to the ytuner config directory, and create or edit the `company.vtuner.com.xml` file (YTuner v1.2.6 does not have this file as default). This file should looks like :
```
<ListOfItems>
  <ItemCount>5</ItemCount>
  <Item>
    <ItemType>Station</ItemType>
    <StationId>UNB3251</StationId>
    <StationName>Feel Good Radio</StationName>
    <StationUrl>http://live.feelgoodradio.eu:8344/stream</StationUrl>
    <StationDesc/>
    <Logo/>
    <StationFormat/>
    <StationLocation/>
    <StationBandWidth/>
    <StationMime/>
    <Relia/>
    <Bookmark/>
  </Item>
  <Item>
    <ItemType>Station</ItemType>
    <StationId>UNB5177</StationId>
    <StationName>NPO 2</StationName>
    <StationUrl>http://icecast.omroep.nl/radio2-bb-mp3</StationUrl>
    <StationDesc/>
    <Logo/>
    <StationFormat/>
    <StationLocation/>
    <StationBandWidth/>
    <StationMime/>
    <Relia/>
    <Bookmark/>
  </Item>
  <Item>
    <ItemType>Station</ItemType>
    <StationId>UNB1307</StationId>
    <StationName>NPO 3FM</StationName>
    <StationUrl>http://icecast.omroep.nl/3fm-bb-mp3</StationUrl>
    <StationDesc/>
    <Logo/>
    <StationFormat/>
    <StationLocation/>
    <StationBandWidth/>
    <StationMime/>
    <Relia/>
    <Bookmark/>
  </Item>
  <Item>
    <ItemType>Station</ItemType>
    <StationId>UNB3252</StationId>
    <StationName>Pinguin Radio</StationName>
    <StationUrl>http://streams.pinguinradio.com/PinguinRadio192.mp3</StationUrl>
    <StationDesc/>
    <Logo/>
    <StationFormat/>
    <StationLocation/>
    <StationBandWidth/>
    <StationMime/>
    <Relia/>
    <Bookmark/>  
</Item>
  <Item>
    <ItemType>Station</ItemType>
    <StationId>UNB83158</StationId>
    <StationName>Pinguin Classics</StationName>
    <StationUrl>http://streams.pinguinradio.com/PinguinClassics192.mp3</StationUrl>
    <StationDesc/>
    <Logo/>
    <StationFormat/>
    <StationLocation/>
    <StationBandWidth/>
    <StationMime/>
    <Relia/>
    <Bookmark/>
  </Item>
</ListOfItems>
```

:exclamation:  If you see in the YTuner's log line like this one  :
```
Dbg : GET /setupapp/Company/asp/browsexpa/loginXML.asp?mac=7bb9a18642c474cd63d3ad0a82673104&dlang=eng
```
use a `7bb9a18642c474cd63d3ad0a82673104.xml` file instead `company.vtuner.com.xml` with the same content.

Change every favorite Station Id with the numbers you have written down before and add UNB before so that you have something like this <StationId>UNB3251</StationId> with the corresponding number seen above.  
For the same block add a url pointing to a radio stream. For instance I will put     <StationUrl>http://direct.franceinter.fr/live/franceinter-hifi.aac</Station>
You can find radio stream urls here http://radio-browser.info

9/ restart ytuner, it should now work

If you are reading this for the first time and don't want to read the entire discussion, please read this https://github.com/coffeegreg/YTuner/discussions/68#discussioncomment-12071297 too.

Remember. This tutorial is only for Libratone devices which are quite basic and cannot use most of the features offered by YTuner.

**Comment by coffeegreg** [comment]
Below is an example of the `company.vtuner.com.xml` file from the `config` subdir needed for the Lbratone Zipp speaker.
[company.vtuner.com.zip](https://github.com/user-attachments/files/18632481/company.vtuner.com.zip)

If you see line like this one :
```
Dbg : GET /setupapp/Company/asp/browsexpa/loginXML.asp?mac=12345mymacidfromdevice&dlang=eng
```
use a `12345mymacidfromdevice.xml` file instead `company.vtuner.com.xml`.

**Comment by coffeegreg** [comment]
Moving to "Discussions" 👍

**Comment by 01sonne** [comment]
Unfortunately it does not work for me. Seems to only work if device has not been reset during testing. My device is trying to login to vtuner with the mac id:

> YTuner v1.2.6 Copyright (c) 2024 Greg P. (https://github.com/coffeegreg)
> 3-2-25 14:22:27 : Inf : Starting services...
> 3-2-25 14:22:27 : Inf : Loading RB UUIDs cache file.
> 3-2-25 14:22:27 : Inf : Successfully loaded 53435 RB UUIDs from cache file.
> 3-2-25 14:22:27 : Inf : Web Service: listening on: 127.0.0.1:8010.
> 3-2-25 14:23:08 : Dbg : GET /setupapp/Company/asp/browsexpa/loginXML.asp?token=0.
> 3-2-25 14:23:08 : Dbg : GET /setupapp/Company/asp/browsexpa/loginXML.asp?mac=12345mymacidfromdevice&dlang=eng.

**Comment by ndx1905-github** [comment]
Indeed this works if your favorites are still stored in the speaker. If you reset then you have to understand the process to add favorites in the first place which is a different scope 

It looks however like the semantics is the same as noxon which provides some documentation about the api and what is sent and expected in return. 

https://cweiske.de/noxon-api.htm#initial-urls

The author also provides a code for the server side it seems (links are one the page above)

I don’t know if turner does or even can emulate this initial setup process

**Reply by coffeegreg** [reply]
@01sonne 
If you have reset your device and removed all stored in memory favourites I can't help you. As you can see your device doesn't query YTuner machine for any radio station info like in @ndx1905-github case :
```
31-1-25 17:20:00 : Dbg : GET /setupapp/company/asp/Browsexpa/Search.asp?sSearchtype=3&search=3251.
31-1-25 17:20:12 : Dbg : GET /setupapp/company/asp/Browsexpa/Search.asp?sSearchtype=3&search=5177.
31-1-25 17:20:19 : Dbg : GET /setupapp/company/asp/Browsexpa/Search.asp?sSearchtype=3&search=1307.
31-1-25 17:20:26 : Dbg : GET /setupapp/company/asp/Browsexpa/Search.asp?sSearchtype=3&search=3252.
31-1-25 17:20:33 : Dbg : GET /setupapp/company/asp/Browsexpa/Search.asp?sSearchtype=3&search=83158.
```
The only difference is that you should use a xml file with the name `12345mymacidfromdevice.xml` but in this case it doesn't matter anyway.  If you manage how to restore/store new stations into device memory, follow @ndx1905-github instructions carefully.

> It looks however like the semantics is the same as noxon which provides some documentation

This documentation is not provided by Noxon but by Christian Weiske.

> I don’t know if turner does or even can emulate this initial setup process

YTuner use `LoginXML.asp` initial URL but this will not restore the favourite stations of @01sonne device.

**Comment by evkruining2** [comment]
This seems like an excellent work-around. Thank you for the effort.

Unfortunately it doesn't seem to work with my Zipp. My device switches through the presets and I've copied and modified the company.vtuner.com.xml file as instructed but no sound comes out of the speaker. The ytuner console returns this information:

```
YTuner v1.2.6 Copyright (c) 2024 Greg P. (https://github.com/coffeegreg)
3-2-25 17:39:51 : Inf : Starting services...
3-2-25 17:39:51 : Inf : DNS Service: listening on: 192.168.2.18:53.
3-2-25 17:39:51 : Inf : Web Service: listening on: 192.168.2.18:80.
3-2-25 17:40:05 : Dbg : Device : ? -> company.vtuner.com.
3-2-25 17:40:05 : Dbg : GET /setupapp/company/asp/Browsexpa/Search.asp?sSearchtype=3&search=23567.
3-2-25 17:40:16 : Dbg : Device : ? -> company.vtuner.com.
3-2-25 17:40:16 : Dbg : GET /setupapp/company/asp/Browsexpa/Search.asp?sSearchtype=3&search=38199.

```
Any suggestions as to get this going? I feel I'm pretty close :-)

Thanks in advance.

**Reply by coffeegreg** [reply]
Should work as expected. Show us your `company.vtuner.com.xml` file.

**Reply by evkruining2** [reply]
I copied your company.vtuner.com.xml example and edited the station numbers as documented. I played around with some station URLs but none of them play any sound on the Zipp (but do work in my browser when I paste them on my workstation, so the station URLs seem to be valid).

Here's a snippet of my company.vtuner.com.xml file:

```
<?xml version="1.0" encoding="utf-8"?>
<ListOfItems>
  <ItemCount>5</ItemCount>
  <Item>
    <ItemType>Station</ItemType>
    <StationId>UNB23567</StationId>
    <StationName>Splash 90s Dance</StationName>
    <StationUrl>http://direct.franceinter.fr/live/franceinter-hifi.aac</StationUrl>
    <StationDesc/>
    <Logo/>
    <StationFormat>Dance</StationFormat>
    <StationLocation/>
    <StationBandWidth/>
    <StationMime/>
    <Relia/>
    <Bookmark/>
  </Item>
  <Item>
    <ItemType>Station</ItemType>
    <StationId>UNB38199</StationId>
    <StationName>FFH - Eurodance</StationName>
    <StationUrl>https://caster05.streampakket.com/proxy/8321/stream</StationUrl>
    <StationDesc/>
    <Logo/>
    <StationFormat>Dance</StationFormat>
    <StationLocation/>
    <StationBandWidth/>
    <StationMime/>
    <Relia/>
    <Bookmark/>
  </Item>
[...]
```

**Reply by coffeegreg** [reply]
As I wrote above :
>If you see line like this one :
```
Dbg : GET /setupapp/Company/asp/browsexpa/loginXML.asp?mac=12345mymacidfromdevice&dlang=eng
```
>use a `12345mymacidfromdevice.xml` file instead `company.vtuner.com.xml`.

another things:
- Do not use `https` links. Your device probably doesn't support TLS/SSL. Use `http` instead.
- Are you sure that your device support AAC audio streams like this one `http://direct.franceinter.fr/live/franceinter-hifi.aac` ? Use some mp3 for a try like this one : http://mp3.ffh.de/ffhchannels/hqeurodance.mp3
- Try to use direct links. Maybe your device doesn't support HTTP 302 redirects : Read this comment : https://github.com/coffeegreg/YTuner/issues/58#issuecomment-2629305708

If the above does not help try to add  `<StationMime>` like :
`<StationMime>MP3</StationMime>`
and bitrate like
`<StationBandWidth>128</StationBandWidth>`
but first check what the audio codec (mp3/aac) and bitrate of the given station is.
Good luck :+1:

**Reply by evkruining2** [reply]
Thanks Greg, unfortunately no luck...

After modifying the company.vtuner.com.xml file per your instructions, I launched ytuner again and switched presets for a bit:

```
YTuner v1.2.6 Copyright (c) 2024 Greg P. (https://github.com/coffeegreg)
4-2-25 08:34:07 : Inf : Starting services...
4-2-25 08:34:07 : Inf : DNS Service: listening on: 192.168.2.18:53.
4-2-25 08:34:07 : Inf : Web Service: listening on: 192.168.2.18:80.
4-2-25 08:34:23 : Dbg : Device : ? -> company.vtuner.com.
4-2-25 08:34:23 : Dbg : GET /setupapp/company/asp/Browsexpa/Search.asp?sSearchtype=3&search=13417.
4-2-25 08:34:43 : Dbg : Device : ? -> company.vtuner.com.
4-2-25 08:34:43 : Dbg : GET /setupapp/company/asp/Browsexpa/Search.asp?sSearchtype=3&search=23567.
4-2-25 08:34:48 : Dbg : Device : ? -> company.vtuner.com.
4-2-25 08:34:48 : Dbg : GET /setupapp/company/asp/Browsexpa/Search.asp?sSearchtype=3&search=13417.
```

Still not a sound from my Zipp.

The snippet from the company.vtuner.com.xml file with the StationId, StationMime and StationBandWidth directives:

  ```
[...]
<Item>
    <ItemType>Station</ItemType>
    <StationId>UNB13417</StationId>
    <StationName>1000 90er - laut.fm</StationName>
    <StationUrl>http://mp3.ffh.de/ffhchannels/hqeurodance.mp3</StationUrl>
    <StationDesc/>
    <Logo/>
    <StationFormat/>
    <StationLocation>Germany</StationLocation>
    <StationBandWidth>128</StationBandWidth>
    <StationMime>MP3</StationMime>
    <Relia/>
    <Bookmark/>
  </Item>
[...]
```

**Reply by coffeegreg** [reply]
@ndx1905-github 
Did you try YTuner v1.2.6 ? Still working?

@evkruining2 
Have you filled whole 5 radio stations ? Pay attention to this : `<ItemCount>5</ItemCount>`

@ndx1905-github 
Can you exchange each other with `company.vtuner.com.xml` files and check it?

Help each other :+1:

**Reply by evkruining2** [reply]
Yes, 5 stations are configured in my xml config and the <ItemCount>5</ItemCount> is there too

**Reply by coffeegreg** [reply]
`company.vtuner.com.xml` placed in `config` subdir ?
`company.vtuner.com.xml` should be utf-8 encoded or at least ansi format.
If you are familiar with network sniffer like wireshark you can check if YTuner send response to your device ... :thinking: 
Let's wait for @ndx1905-github ... exchange `company.vtuner.com.xml` files and of course change IDs and check it. Maybe there will be some conclusions ... :thinking: 

> Still not a sound from my Zipp.

Turn up the volume ? :wink:

**Reply by evkruining2** [reply]
It's working now!!

I saw in another thread that _CommonBookmark_ within the [Bookmark] section needs to be set to 0 in ytuner.ini. Once I did that, my Zipp started to come alive! 
I've modified my company.vtuner.com.xml and cleaned it up a bit and added my favorites and they all work fine!

Here's my working company.vtuner.com.xml:
```
<ListOfItems>
  <ItemCount>5</ItemCount>
  <Item>
    <ItemType>Station</ItemType>
    <StationId>UNB23567</StationId>
    <StationName>Feel Good Radio</StationName>
    <StationUrl>http://live.feelgoodradio.eu:8344/stream</StationUrl>
    <StationDesc/>
    <Logo/>
    <StationFormat/>
    <StationLocation/>
    <StationBandWidth/>
    <StationMime/>
    <Relia/>
    <Bookmark/>
  </Item>
  <Item>
    <ItemType>Station</ItemType>
    <StationId>UNB38199</StationId>
    <StationName>NPO 2</StationName>
    <StationUrl>http://icecast.omroep.nl/radio2-bb-mp3</StationUrl>
    <StationDesc/>
    <Logo/>
    <StationFormat/>
    <StationLocation/>
    <StationBandWidth/>
    <StationMime/>
    <Relia/>
    <Bookmark/>
  </Item>
  <Item>
    <ItemType>Station</ItemType>
    <StationId>UNB13417</StationId>
    <StationName>NPO 3FM</StationName>
    <StationUrl>http://icecast.omroep.nl/3fm-bb-mp3</StationUrl>
    <StationDesc/>
    <Logo/>
    <StationFormat/>
    <StationLocation/>
    <StationBandWidth/>
    <StationMime/>
    <Relia/>
    <Bookmark/>
  </Item>
  <Item>
    <ItemType>Station</ItemType>
    <StationId>UNB36322</StationId>
    <StationName>Pinguin Radio</StationName>
    <StationUrl>http://streams.pinguinradio.com/PinguinRadio192.mp3</StationUrl>
    <StationDesc/>
    <Logo/>
    <StationFormat/>
    <StationLocation/>
    <StationBandWidth/>
    <StationMime/>
    <Relia/>
    <Bookmark/>  
</Item>
  <Item>
    <ItemType>Station</ItemType>
    <StationId>UNB24570</StationId>
    <StationName>Pinguin Classics</StationName>
    <StationUrl>http://streams.pinguinradio.com/PinguinClassics192.mp3</StationUrl>
    <StationDesc/>
    <Logo/>
    <StationFormat/>
    <StationLocation/>
    <StationBandWidth/>
    <StationMime/>
    <Relia/>
    <Bookmark/>
  </Item>
</ListOfItems>
```

Thank you all for your help and support. Much appreciated!

**Reply by coffeegreg** [reply]
Tell others that the lack of vTuner services is not a death sentence for devices that used it. YTuner's `Confirmed working` list is waiting to be expanded :+1: :rocket: 
@ndx1905-github and @evkruining2 become experts in bringing Libratone devices back to life with YTuner. :+1: Who's next :question:

**Reply by evkruining2** [reply]
Thanks!

Just one caveat: configuring the Zipp directly to point to the ytuner DNS never worked for me. When I hard-code the ip address into the DNS settings of the Zipp, my ytuner instance never seem to get any requests from the Zipp when cycling through the presets.

I managed to get it to work by tweaking my local DNS server (Pihole) with a regex expression to redirect all vtuner.com requests to my ytuner instance.

**Reply by coffeegreg** [reply]
@ndx1905-github @evkruining2
Can you check TLS/SSL (https) support on your devices ? 
Can you check not-direct links to be sure about HTTP 302 redirects support on your devices ?
What about AAC and AAC+ support on Libratone ?

**Reply by coffeegreg** [reply]
> Just one caveat: configuring the Zipp directly to point to the ytuner DNS never worked for me. When I hard-code the ip address into the DNS settings of the Zipp, my ytuner instance never seem to get any requests from the Zipp when cycling through the presets.

Did you enabled YTuner's DNS service with `Enable=1` option in `[DNSServer]` section ?
@ndx1905-github : Did you have the same ?
DNS service should work on UDP/53 port. Maybe for some reason Libratone communicates using TCP/53. :thinking:  Can you check it again? DNS service is crucial ...
Remember that your advice and observations written here can help others.

**Reply by TheBossME** [reply]
hello Greg,

I can't keep up with reading the github messages. great how you help people in such a short time..

I take my hat off to you.

great! keep it up.

I see in many forums that vtuner no longer works reliably or has been discontinued.

I use the ytuner service almost around the clock.

maybe someone outside of Europe knows of similar radio services like radio-browser.info

it would be great to implement that.

by the way, I configured pihole and adguard from the start so that I didn't have to change anything on the DSP-Z7. dnsmasq is my friend.

I'll include you in my evening prayers!

live long and in peace! to quote spock

Regards
Beatrice

**Reply by coffeegreg** [reply]
I was born to help others. :+1:  Maybe one day I'll need help from others...

> by the way, I configured pihole and adguard from the start so that I didn't have to change anything on the DSP-Z7. dnsmasq is my friend.

Sure, but most people need solutions that work out of the box. That's why I added DNS service to YTuner and I would like it to work for everyone who needs it.

**Reply by evkruining2** [reply]
> > Just one caveat: configuring the Zipp directly to point to the ytuner DNS never worked for me. When I hard-code the ip address into the DNS settings of the Zipp, my ytuner instance never seem to get any requests from the Zipp when cycling through the presets.
> 
> Did you enabled YTuner's DNS service with `Enable=1` option in `[DNSServer]` section ? @ndx1905-github : Did you have the same ? DNS service should work on UDP/53 port. Maybe for some reason Libratone communicates using TCP/53. 🤔 Can you check it again? DNS service is crucial ... Remember that your advice and observations written here can help others.

Yes, Enable=1 in [DNSServer]. The ytuner console tells me it's listening on port 53. When I configure my iPhone to use that DNS server, it works just fine. Looks like the Zipp does something funky or just doesn't like a hard-coded DNS entry.

**Reply by coffeegreg** [reply]
> Looks like the Zipp does something funky or just doesn't like a hard-coded DNS entry.

I wonder what it was like in @ndx1905-github Zipp speaker case. :thinking: 
I'll try to add DNS support for TCP as well. :thinking: 
@TheBossME @evkruining2 Can you check if pihole uses TCP/53 in addition to UDP/53?

In fact, if DNS queries were reaching YTuner's DNS service , the following entry should appear in the log:
`DNS Query intercept : xxxxxxx.vtuner.com`
Looks like Libratone sends non-standard DNS query.. :thinking: 
@evkruining2 When I add TCP/53 support to YTuner DNS service I count on you to test it. :wink:

**Reply by TheBossME** [reply]
Pi-hole primarily uses UDP for DNS queries. However, it can also use TCP when necessary, such as for large queries or when DNSSEC is enabled.
As for ports, Pi-hole uses port 53 by default for DNS queries.

**Reply by evkruining2** [reply]
> In fact, if DNS queries were reaching YTuner's DNS service , the following entry should appear in the log: `DNS Query intercept : xxxxxxx.vtuner.com`

Exactly. I saw that when I configured my iPhone to use ytuners DNS and point the browser to bogus.vtuner.com. I got the DNS Query intercept message instantly. No such thing happens when I fire up my Zipp and cycle through the presets (when I hard-code the ytuner ip address as the preferred DNS in the Zipp config)

**Reply by evkruining2** [reply]
>  @evkruining2 When I add TCP/53 support to YTuner DNS service I count on you to test it. 😉

Most definitely! You can count on me!

**Reply by coffeegreg** [reply]
Is it possible to monitor/observe what protocol requests (TCP or UDP) are coming in on the pihole?

**Reply by TheBossME** [reply]
> Is it possible to monitor/observe what protocol requests (TCP or UDP) are coming in on the pihole?

Of course, wireshark or tcpdump should do the job.

**Reply by coffeegreg** [reply]
Sure :smile: But I can't expect others to know how to use wireshark. I thought pihole had some user-friendly interface to monitor incoming requests :wink:

**Reply by TheBossME** [reply]
i'm not representative. I'm using special configuration with pihole v6 development version. So I can't do that actually.

My requests are not via dnssec so the answers are UDP only with my Yamaha.

Switch pihole to dnssec and install tcpdump on the pihole machine, then enter 
tcpdump -i eth0 host 192.168.x.x (Adress of receiver)

clear dns cache before doing that. Pihole generally answers from cache.


Pi-hole typically responds to DNS queries using the UDP protocol. UDP is more efficient and faster for most DNS queries due to its connectionless nature and lower overhead.
However, there are specific cases where Pi-hole will respond to DNS queries using the TCP protocol:
DNS Responses Too Large for UDP: When the size of the DNS response exceeds the maximum UDP packet size (512 bytes without EDNS0 or up to 4096 bytes with EDNS0), the query will switch to TCP.
DNSSEC: If DNSSEC is enabled and the DNS responses contain signatures that are larger, TCP may be used.
Lost or Fragmented UDP Packets: If UDP packets are lost or fragmented, the client may decide to resend the query over TCP to ensure reliability.
In these situations, Pi-hole automatically switches to TCP to ensure that DNS queries are answered correctly.

**Reply by ndx1905-github** [reply]
I couldn't save DNS settings in Libratone ZIPP. It's supposed to be possible if you connect to http://yourLibratonelocalIP/cgi?Network and go to advanced settings, where you should be able to enter ytuner ip as your gateway or preferred DNS like here

![image](https://github.com/user-attachments/assets/aae16cb9-f003-4980-adb7-38d51dfa91a0)

However, when I apply the settings it never sticks.

So I had to resort to use my opewrt router to redirect all trafic meant for *.vtuner.com to be redirected to local ytuner.
This worked.

**Reply by evkruining2** [reply]
I saw the same behavior on my Zipps (I have a couple of them). I found out that the custom ip setting do stick when you also re-select the WiFi access point in the same go. The Zipp will then chime to signal it disconnects and soon after, if you didn’t mess up the config, it will chime again to tell you it successfully established a fresh connection. 

Still, even with a custom dns configured, the thing won’t talk to ytuners dns.

**Reply by coffeegreg** [reply]
@ndx1905-github 
Indeed, now I noticed that you wrote about it. Sorry, I didn't read it carefully.
So in the case when you can't save a new DNS (YTuner's IP address) in the settings, the only thing left is to modify the entries on the router.

> So I had to resort to use my opewrt router to redirect all trafic meant for *.vtuner.com to be redirected to local ytuner.

In fact, you can run YTuner on your OpenWRT router too. You don't need RPi. :rocket: Look here https://github.com/coffeegreg/YTuner/issues/37

**Reply by evkruining2** [reply]
> @ndx1905-github @evkruining2 Can you check TLS/SSL (https) support on your devices ? Can you check not-direct links to be sure about HTTP 302 redirects support on your devices ? What about AAC and AAC+ support on Libratone ?

I will check when I get back in the office tomorrow. My quick impression so far is that the Zipp doesn't support https and redirects are trick because they might redirect to https services too.
Haven't tried AAC and AAC+ yet. Will do that tomorrow and report back to you.

I will also install tcpdump on my pihole instance tomorrow and do some sniffing to see if the Zipp uses TCP for DNS queries. Stay tuned.

Oh and btw, thanks again @coffeegreg for creating ytuner and your support!

**Reply by evkruining2** [reply]
Ok, I did some testing this morning and I can confirm that TLS/SSL (https) does _not_ work on the Zipp. Every link to a radio station that starts with https:// will generate a short beep when I select the preset that is assigned to it.

AAC and AAC+ do work perfectly, in all conceivable bitrates. I tested against streams with 96, 128 and 320 kbps. All good.

I couldn't find any non-direct links to test with but if you can supply me one, I'm happy to check it out.

**Reply by evkruining2** [reply]
Ah, and I did a tcpdump on my pihole instance too, using the command 

tcpdump -i eth0 host 192.168.2.141

(192.168.2.141 is the ip address of my Zipp unit)

The relevant traffic that was captured while switching two presets:
```

09:17:39.083640 IP 192.168.2.141.13896 > pihole.example.com.domain: 55495+ AAAA? company.vtuner.com. (36)
09:17:39.083937 IP pihole.example.com.domain > 192.168.2.141.13896: 55495* 1/0/0 AAAA :: (64)
09:17:39.087591 IP 192.168.2.141.42844 > pihole.example.com.domain: 34101+ A? company.vtuner.com. (36)
09:17:39.087912 IP pihole.example.com.domain > 192.168.2.141.42844: 34101* 1/0/0 A 192.168.2.18 (52)
09:17:39.092312 ARP, Request who-has 192.168.2.18 tell 192.168.2.141, length 46
09:17:39.164081 IP 192.168.2.141.22521 > pihole.example.com.domain: 6179+ AAAA? live.feelgoodradio.eu. (39)
09:17:39.192592 IP pihole.example.com.domain > 192.168.2.141.22521: 6179 0/1/0 (104)
09:17:39.199308 IP 192.168.2.141.4028 > pihole.example.com.domain: 15379+ A? live.feelgoodradio.eu. (39)
09:17:39.244742 IP pihole.example.com.domain > 192.168.2.141.4028: 15379 1/0/0 A 163.172.216.200 (55)



09:24:15.039804 IP 192.168.2.141.52556 > 239.255.255.250.1900: UDP, length 346
09:24:15.040386 IP 192.168.2.141.59990 > 239.255.255.250.1900: UDP, length 344
09:24:15.041786 IP 192.168.2.141.43450 > 239.255.255.250.1900: UDP, length 328
09:24:15.655758 IP 192.168.2.141.61493 > pihole.example.com.domain: 57539+ AAAA? company.vtuner.com. (36)
09:24:15.655987 IP pihole.example.com.domain > 192.168.2.141.61493: 57539* 1/0/0 AAAA :: (64)
09:24:15.659150 IP 192.168.2.141.55054 > pihole.example.com.domain: 30311+ A? company.vtuner.com. (36)
09:24:15.659346 IP pihole.example.com.domain > 192.168.2.141.55054: 30311* 1/0/0 A 192.168.2.18 (52)
09:24:15.707179 IP 192.168.2.141.42998 > pihole.example.com.domain: 60365+ A? 22733.live.streamtheworld.com. (47)
09:24:15.726183 IP pihole.example.com.domain > 192.168.2.141.42998: 60365 1/0/0 A 184.104.206.23 (63)
09:24:16.824765 IP 192.168.2.141.mdns > mdns.mcast.net.mdns: 0*- [0q] 3/0/5 (Cache flush) SRV Zipp-Red.local.:7000 0 0, (Cache flush) A 192.168.2.141, (Cache flush) SRV Zipp-Red.local.:7000 0 0 (251)
09:24:17.789245 IP 192.168.2.141.36562 > 239.255.255.250.1800: UDP, length 349
09:24:17.789245 IP 192.168.2.141.60916 > 255.255.255.255.1800: UDP, length 349
09:24:17.904269 IP 192.168.2.141.36562 > 239.255.255.250.1800: UDP, length 349
```

Unfortunately I'm not an expert in tcpdump to determine if the Zipp uses UDP or TCP for the DNS request, based on this output...

**Reply by TheBossME** [reply]
keep in mind, that pihole is caching dns requests.. you must set pihole dnssec parameter first, then stop pihole to clear cache.. then start tcpdump before switching your sound system to on.

one interesting line:

09:24:16.824765 IP 192.168.2.141.mdns > mdns.mcast.net.mdns: 0*- [0q] 3/0/5 (Cache flush) SRV Zipp-Red.local.:7000 0 0, (Cache flush) A 192.168.2.141, (Cache flush) SRV Zipp-Red.local.:7000 0 0 (251)
09:


An mDNS packet was sent from the IP address 192.168.2.141 to the mDNS multicast address.
0- [0q] 3/0/5 (Cache flush) SRV Zipp-Red.local.:7000 0 0*: This is an mDNS response with SRV records (Server Service Records) advertising the service Zipp-Red.local on port 7000.
(Cache flush) A 192.168.2.141: An A record (address record) announcing that the IP address for Zipp-Red.local is 192.168.2.141.
(Cache flush) SRV Zipp-Red.local.:7000 0 0 (251): Repeating the SRV record for the service on port 7000, and the number 251 might indicate the packet size or another specific value.

**Reply by evkruining2** [reply]
I'm not sure but I think those mDNS packets are used by the Zipp to broadcast it's available for Airplay connection, isn't it?

So I enabled dnssec in pihole, restarted it with the 'pihole restartdns' command and started another capture with tcpdump. For reference, my Zipp is 192.168.2.141 and my ytuner instance is on 192.168.2.18

```
10:14:04.869133 IP 192.168.2.141.mdns > mdns.mcast.net.mdns: 0*- [0q] 2/0/3 PTR c4:67:b5:32:d3:50._spotify-connect._tcp.local., PTR _spotify-connect._tcp.local. (207)
10:14:05.859003 IP 192.168.2.141.55331 > pihole.example.com.domain: 32538+ AAAA? company.vtuner.com. (36)
10:14:05.859205 IP pihole.example.com.domain > 192.168.2.141.55331: 32538* 1/0/0 AAAA :: (64)
10:14:05.862492 IP 192.168.2.141.20195 > pihole.example.com.domain: 5143+ A? company.vtuner.com. (36)
10:14:05.873946 IP pihole.example.com.domain > 192.168.2.141.20195: 5143* 1/0/0 A 192.168.2.18 (52)
10:14:05.876567 IP 192.168.2.141.mdns > mdns.mcast.net.mdns: 0*- [0q] 2/0/3 PTR c4:67:b5:32:d3:50._spotify-connect._tcp.local., PTR _spotify-connect._tcp.local. (207)
10:14:05.881566 ARP, Request who-has 192.168.2.18 tell 192.168.2.141, length 46
10:14:05.946956 IP 192.168.2.141.3672 > pihole.example.com.domain: 13540+ AAAA? playerservices.streamtheworld.com. (51)
10:14:05.980773 IP pihole.example.com.domain > 192.168.2.141.3672: 13540 0/1/0 (129)
10:14:05.984135 IP 192.168.2.141.57534 > pihole.example.com.domain: 32441+ A? playerservices.streamtheworld.com. (51)
10:14:06.000688 IP pihole.example.com.domain > 192.168.2.141.57534: 32441 1/0/0 A 192.173.31.109 (67)
10:14:06.082231 IP 192.168.2.141.13923 > pihole.example.com.domain: 37786+ AAAA? 21363.live.streamtheworld.com. (47)
10:14:06.103734 IP pihole.example.com.domain > 192.168.2.141.13923: 37786 0/1/0 (116)
10:14:06.107585 IP 192.168.2.141.41697 > pihole.example.com.domain: 42982+ A? 21363.live.streamtheworld.com. (47)
10:14:06.200820 IP pihole.example.com.domain > 192.168.2.141.41697: 42982 1/0/0 A 202.68.74.78 (63)
```

**Reply by TheBossME** [reply]
1. Poweroff (remove Power plug)

2. install termshark on pihole (text based wireshark)
apt install termshark
pihole reloaddns
termshark -i eth0 -Y "ip.src == <Client-IP>"

3. Replug Power to the device

termshark is better visualization than tcpdump.

The first line should show dns request.. 
click on the "+" when you see the dns entry. Or save the pcap file and post it here.

and you're right. The mdns requests are for Spotify etc.. (not interested)

**Reply by evkruining2** [reply]
![Scherm­afbeelding 2025-02-05 om 11 33 30](https://github.com/user-attachments/assets/aeb6433f-b781-4274-93b9-0b598e32efbb)

Oh wow! I'm entering a whole new universe with this termshark. I have no idea what I'm looking at :-)
I've made a screenshot of the entry where I pressed the preset on my Zipp and where the protocol is DNS. Does this screenshot help at all?
(I noticed the complete pcap file contains a lot of information that I'm reluctant to share...)

**Reply by TheBossME** [reply]
You do it right !

And we see UDP Dns requests.

Good that you've learned a little to analyze network traffic with this powerful termshark tool.

There seems to be no tcp dns request, only UDP.

it looks like, you're network is using Dual-Stack (ipv4/ipv6). Sometimes it produces issues when not setup properly. ipv4/6 is a deep dive.

Greg, any other idea ?

**Reply by ndx1905-github** [reply]
> @ndx1905-github Indeed, now I noticed that you wrote about it. Sorry, I didn't read it carefully. So in the case when you can't save a new DNS (YTuner's IP address) in the settings, the only thing left is to modify the entries on the router.
> 
> > So I had to resort to use my opewrt router to redirect all trafic meant for *.vtuner.com to be redirected to local ytuner.
> 
> In fact, you can run YTuner on your OpenWRT router too. You don't need RPi. 🚀 Look here #37

Yes thanks for the idea. After some consideration, I don't think I will put ytuner on my router itself because 
- I'm afraid of RAM / CPU usage and I want the router to stay lean and mean
- OpenWRT uses a graphical interface 'Luci' that already uses port 80 and I don't want to mess with it
- I have a Rapsberry Pi 4 running just Home Assistant, which uses port 8123 and has nothing on port 80

But for future reference, do you know the RAM / cpu footprint when idle or streaming ?

**Reply by coffeegreg** [reply]
It all depends on the selected cache mode and the intensity of browsing new stations (placing all of them in the cache). It is difficult to determine this unequivocally. If you need more detailed information on how to run YTuner on OpenWRT, ask @rkerschn for help. :+1:

**Reply by evkruining2** [reply]
> @ndx1905-github @evkruining2 Can you check TLS/SSL (https) support on your devices ? Can you check not-direct links to be sure about HTTP 302 redirects support on your devices ? What about AAC and AAC+ support on Libratone ?

Just checked and the Zipp does support HTTP 302 redirects too!
So the only thing that it doesn't support is TLS/SSL

**Comment by coffeegreg** [comment]
@evkruining2 
What is your YTuner machine OS/CPU arch. I'll try to prepare YTuner test binaries with more detailed log about DNS queries :thinking:

**Reply by evkruining2** [reply]
@coffeegreg 
I use a Debian LXC on Proxmox. It’s Debian version 12 x86_64. 
I also have an instance running on a RPI zero 2w running RasberryOS 64 bit ARM

**Reply by coffeegreg** [reply]
> I use a Debian LXC on Proxmox.

You and @TheBossME will get along well :wink: As Beatrice said some day : _You can live without Proxmox but such a life has no sense_ :wink: 
I'll prepare test binaries for  x86_64-linux :+1:

**Comment by evkruining2** [comment]
Ok, after some more testing, sniffing, tweaking and sweating, I need to conclude that the Zipp manual settings are wonky and do not work properly. As mentioned above to @ndx1905-github, the only way to actually save the manual ip and dns settings in the advanced section of the Zipp configuration (web)page, is to also re-select the wifi network.
The manually entered settings for DNS will at least stick but won't work. My DNS server(s) never receive requests from my Zipp once I hard-code the addresses.

The only thing that works is to let the Zipp use DHCP and have it pick-up a DNS server from the DHCP options. For some inexplicable reason, the Zipp then actually does use that address.

On my own network I managed to get it working by adding a DNS regex rule in my pihole configuration to redirect all .vtuner.com requests to my ytuner instance (eliminating the need for DNS-enable ytuner)

For another network (at my girlfriends home) where there's no pihole, I have installed both ytuner and dnsmasq on a RPI zero 2w. Dnsmasq is configured to only act as DHCP server, while ytuner acts as the DNS server. Naturally I had to disable the ip4 DHCP server in the router to prevent unpredictable results. So far this setup also works fine. Hopefully it will prove to be resilient.

@coffeegreg I don't think updated test binaries are needed. Your code is not the issue here. Again, thanks for your help and support!

**Reply by coffeegreg** [reply]
> For another network (at my girlfriends home) where there's no pihole, I have installed both ytuner and dnsmasq on a RPI zero 2w. Dnsmasq is configured to only act as DHCP server, while ytuner acts as the DNS server. Naturally I had to disable the ip4 DHCP server in the router to prevent unpredictable results. So far this setup also works fine. Hopefully it will prove to be resilient.

So ... it looks like YTuner DNS service works fine. :thinking: 
Now it would be a good idea to ask Libratone to fix the DNS related bugs in their software/firmware. :+1: 

@evkruining2 @TheBossME  @ndx1905-github 
Really good job. :+1:  It's a pleasure to work with such people. :clap:

**Reply by evkruining2** [reply]
@coffeegreg 
> Now it would be a good idea to ask Libratone to fix the DNS related bugs in their software/firmware.

Indeed. I've reached out to Libratone support, asking if there is fix available. Fingers crossed :-)
In my email to them I did mention Ytuner and linked to your git page and this thread.  I hope you don't mind.

**Reply by andrew-lawson-tumelo** [reply]
I think I had these sort of issues... but I told Claude to investigate and fix it... eventually it came back and everything worked... thank goodness for the power of AI.

**Comment by ndx1905-github** [comment]
So Libratone has fixed the problem on their side and pushed a firmware update https://libratone.shop/pages/support 

I wonder if it breaks the ytuner fix. Don't dare to update.. Anyone tried?

**Reply by evkruining2** [reply]
That is good news, however...

I decided to jump in with one of my Zipps and do the firmware update. The Libratone webpage claims that the update takes 3-5 minutes. My Zipp has been blinking at me for over 20 minutes now and doesn't respond to anything anymore. Even the power button doesn't respond...

Looks like this firmware update has bricked my Zipp :-(

**Reply by evkruining2** [reply]
Oh wow! My Zipp miraculously came back to life! About 40 minutes after started the firmware update, the blinking dots stopped blinking an my Zipp seemed to have powered down. It started back up again, connected to my network and shows as online in the Libratone app.

I didn't change my phole rules so all requests to vtuner.com are still routed through ytuner. I looked at the ytuner log and now my Zipp is trying to connect to company2.vtuner.com, when I press one of the presets :-)

When I disable my pihole catch-all rule and set free the vtuner domain, all seems to work again!!

The presets work and the radio station browser in the app also works again!

**Reply by 01sonne** [reply]
Yes, I also updated my Zipp Mini. It is working again without the redirects to ytuner.
However, when I switch to ytuner the bookmarks are not working. I only hear a short "beep" and a red error blinking on the box.

> Feb 14 08:32:21 bpi1 ytuner[24093]: 14-2-25 08:32:21 : Dbg : Device : ? -> company2.vtuner.com.
> Feb 14 08:32:21 bpi1 ytuner[24093]: 14-2-25 08:32:21 : Dbg : GET /setupapp/company/asp/Browsexpa/Search.asp?sSearchtype=3&search=5670.
> Feb 14 08:36:09 bpi1 ytuner[24093]: 14-2-25 08:36:09 : Dbg : Device : ? -> company2.vtuner.com.
> Feb 14 08:36:09 bpi1 ytuner[24093]: 14-2-25 08:36:09 : Dbg : GET /setupapp/company/asp/Browsexpa/Search.asp?sSearchtype=3&search=8047.

Interestingly when I activated stations.ini, the box played the first station from the ini file on all preset buttons.

**Reply by evkruining2** [reply]
> Yes, I also updated my Zipp Mini. It is working again without the redirects to ytuner.
However, when I switch to ytuner the bookmarks are not working. I only hear a short "beep" and a red error blinking on the box.

It will start working through ytuner when you copy your company.vtuner.com.xml to company2.vtuner.com.xml configuration file in the ytuner/config directory. Notice the "Device: ? -? company2.ytuner.com" line in the ytuner log? That has changed after the firmware upgrade (before it queried company.vtuner.com)

**Reply by 01sonne** [reply]
I already changed that to company2.vtuner.com.xml, unfortunately that had no effect.

**Reply by andrew-lawson-tumelo** [reply]
I got Claude to take on the task... and it came up with this... hopefully there's something of use... I managed to get the thing to work, 5 presets per speaker, with the presets maintained on the PI.

# YTuner Setup for Libratone Speakers

## Overview
This document explains how YTuner has been configured to work with Libratone speakers, which have hardcoded preset IDs that cannot be changed.

## The Problem
Libratone speakers have firmware-embedded preset IDs (like 3158, 13417, 80195, etc.) that are sent to the vTuner service when you press preset buttons. YTuner v1.2.6 has basic Libratone support but requires proper configuration.

## The Solution

### 1. Key Configuration Changes

**File: `/opt/ytuner/ytuner.ini`**
- Changed `CommonBookmark=0` (was 1)
  - This allows device-specific bookmark files instead of a single shared file
  - Each speaker gets its own XML file based on its IP address

**File: `/etc/nginx/sites-available/ytuner-proxy`**
- Changed `proxy_set_header Host $remote_addr;` (was `192.168.5.180`)
  - Uses each speaker's IP address as its unique device ID
  - Allows YTuner to serve different presets to different speakers

### 2. Device-Specific Configuration Files

Each Libratone speaker has its own XML file in `/opt/ytuner/config/`:

**Speaker 1: `/opt/ytuner/config/192.168.5.31.xml`**
- Preset IDs: 3158, 13417, 80195, 36322, 24570
- Mapped to: Capital FM, Heart London, Heart 80s, Gold UK, Radio Caroline

**Speaker 2: `/opt/ytuner/config/192.168.5.11.xml`**
- Preset IDs: 1357, 26128, 49272, 3159, 80195
- Mapped to: Capital FM, Heart London, Heart 80s, Gold UK, Radio Caroline

### 3. How It Works

When a Libratone speaker presses preset button:
1. Speaker sends request: `Search.asp?sSearchtype=3&search=3158`
2. Nginx forwards request with `Host: 192.168.5.31` (speaker's IP)
3. YTuner checks if `/opt/ytuner/config/192.168.5.31.xml` exists
4. If exists, prepends "UNB" to search ID → looks for `UNB3158` in that XML file
5. Returns the matching station URL to the speaker

## Adding a New Libratone Speaker

### Step 1: Identify the Speaker's IP and Preset IDs

1. Connect the new speaker to YTuner (configure its DNS to point to this server)
2. Press each preset button on the speaker
3. Check the logs to find the preset IDs:
```bash
tail -100 /var/log/nginx/access.log | grep "sSearchtype=3"
```
Look for lines like: `192.168.5.XX - - ... "search=XXXXX"`

### Step 2: Create Device Configuration File

Create `/opt/ytuner/config/192.168.5.XX.xml` (replace XX with speaker's IP):

```xml
<?xml version="1.0" encoding="utf-8"?>
<ListOfItems>
  <ItemCount>5</ItemCount>
  <Item>
    <ItemType>Station</ItemType>
    <StationId>UNB[PRESET_ID_1]</StationId>
    <StationName>Station Name</StationName>
    <StationUrl>http://stream-url-here</StationUrl>
    <StationDesc>Preset 1</StationDesc>
    <Logo></Logo>
    <StationFormat>Genre</StationFormat>
    <StationLocation></StationLocation>
    <StationBandWidth></StationBandWidth>
    <StationMime></StationMime>
    <Relia>3</Relia>
    <Bookmark></Bookmark>
  </Item>
  <!-- Repeat for each preset with UNB[PRESET_ID_2], etc. -->
</ListOfItems>
```

**Important Notes:**
- StationId MUST be `UNB` + the preset ID (e.g., `UNB3158`)
- Use HTTP URLs, not HTTPS (Libratone doesn't support HTTPS)
- Use MP3 codec streams (AAC may not work)

### Step 3: Restart YTuner
```bash
sudo systemctl restart ytuner
```

## Customizing Stations

### To Change a Station on a Speaker

1. Edit the device's XML file:
```bash
sudo nano /opt/ytuner/config/192.168.5.31.xml
```

2. Find the preset you want to change (by StationId)

3. Update the `StationName` and `StationUrl`
   - Keep the `StationId` unchanged (must remain `UNB[ID]`)
   - Use HTTP URLs only
   - Use MP3 streams only

4. Restart YTuner:
```bash
sudo systemctl restart ytuner
```

### Finding Station URLs

Search for stations on Radio Browser:
```bash
curl -s "http://all.api.radio-browser.info/json/stations/search?name=STATION_NAME&countrycode=GB&codec=MP3&hidebroken=true" | python3 -c "import sys, json; stations = json.load(sys.stdin); [print(f\"{s['name']}: {s['url']}\") for s in stations[:5]]"
```

Replace `STATION_NAME` with the station you're looking for.

## Station Compatibility

**✅ Compatible:**
- HTTP URLs (http://)
- MP3 codec
- Direct stream URLs

**❌ Not Compatible:**
- HTTPS URLs (https://)
- AAC codec (may not work)
- HLS streams (.m3u8)
- Playlist files (.m3u, .pls)

## Troubleshooting

### Speaker plays the same station for all presets

1. Check that `CommonBookmark=0` in `/opt/ytuner/ytuner.ini`
2. Check that device XML file exists: `ls /opt/ytuner/config/192.168.5.XX.xml`
3. Check nginx config uses `$remote_addr`:
```bash
grep "proxy_set_header Host" /etc/nginx/sites-available/ytuner-proxy
```
Should show: `proxy_set_header Host $remote_addr;`

### Speaker doesn't play anything

1. Check if the stream URL works:
```bash
timeout 3 curl http://stream-url-here | head -c 100
```

2. Make sure the URL is HTTP, not HTTPS

3. Check YTuner logs:
```bash
tail -50 /var/log/ytuner.log
```

### Find which presets are being used

Check nginx access log:
```bash
tail -50 /var/log/nginx/access.log | grep "192.168.5.XX"
```

### Restart services after changes

```bash
# After changing ytuner.ini or station XML files:
sudo systemctl restart ytuner

# After changing nginx config:
sudo nginx -t
sudo systemctl reload nginx
```

## File Locations

- **YTuner config:** `/opt/ytuner/ytuner.ini`
- **YTuner binary:** `/opt/ytuner/ytuner`
- **Station lists:** `/opt/ytuner/config/stations.ini`
- **Device configs:** `/opt/ytuner/config/192.168.5.XX.xml`
- **YTuner logs:** `/var/log/ytuner.log`
- **Nginx config:** `/etc/nginx/sites-available/ytuner-proxy`
- **Nginx logs:** `/var/log/nginx/access.log`

## Current Configuration

**Server:** 192.168.5.180
**YTuner Version:** v1.2.6

**Configured Speakers:**
- 192.168.5.31 (Preset IDs: 3158, 13417, 80195, 36322, 24570)
- 192.168.5.11 (Preset IDs: 1357, 26128, 49272, 3159, 80195)

**Current Stations (Both Speakers):**
1. Capital FM London - http://media-ice.musicradio.com/CapitalMP3
2. Heart London - http://ice-sov.musicradio.com/HeartLondonMP3
3. Heart 80s - http://media-ice.musicradio.com/Heart80sMP3
4. Gold UK - http://media-ice.musicradio.com/GoldMP3
5. Radio Caroline - http://78.129.202.200:8040/

## Additional Resources

- YTuner GitHub: https://github.com/coffeegreg/YTuner
- Libratone Discussion: https://github.com/coffeegreg/YTuner/discussions/68
- Radio Browser API: http://all.api.radio-browser.info/

## Notes

- This setup was configured on February 13, 2026
- The solution works around Libratone's hardcoded preset IDs by using device-specific XML bookmark files
- Each speaker can have different stations assigned to its presets
- The configuration survives YTuner updates (XML files are in config directory)
