### ISSUE TITLE
RX-V2700 Connection Error - GET /setupapp/Yamaha/asp/BrowseXML/loginXML.asp?mac=...&dlang=eng&fver=M

### ISSUE THREAD

**Issue by JSa1987** [coffeegreg/YTuner#120]
Hello,

I'm trying to use YTunder with a Yamaha RX-V2700.

I downloaded the linux 64bit compiled version and started with no problems:
```
$ sudo ./ytuner 
YTuner v1.2.6 Copyright (c) 2024 Greg P. (https://github.com/coffeegreg)
25-4-25 06:41:33 : Inf : Starting services...
25-4-25 06:41:33 : Inf : Successfully loaded 10 my stations.
25-4-25 06:41:33 : Dbg : Database library : 3.40.1.
25-4-25 06:41:33 : Inf : Checking local database.
25-4-25 06:41:33 : Inf : Local database is ready.
25-4-25 06:41:33 : Inf : DNS Service: listening on: 192.168.60.148:53.
25-4-25 06:41:33 : Inf : Web Service: listening on: 192.168.60.148:80.
```

I pointed `radioyamaha.vtuner.com ` to 192.168.60.148 and set up in the RX-V2700 both the primary and secondary DNS as 192.168.60.148.

Now when I try to access the internet radio in the RX-V2700 I get `Connection Error`. Each time I try to access the internet radio from the RX-V2700 I get the following line in the YTuner logs (two attempts in the example below):
```
25-4-25 06:41:42 : Dbg : GET /setupapp/Yamaha/asp/BrowseXML/loginXML.asp?mac=baf0df2107014571ae41be29811cb6bc&dlang=eng&fver=M.
25-4-25 06:41:59 : Dbg : GET /setupapp/Yamaha/asp/BrowseXML/loginXML.asp?mac=baf0df2107014571ae41be29811cb6bc&dlang=eng&fver=M.
```

Is there any configuration option I should adjust for YTuner to work with the RX-V2700?
Maybe this receiver send a slightly different initial request?

**Comment by JSa1987** [comment]
Small update.
I restarted the RX-V2700 (maybe this was needed to get it to use the new DNS entered) and I now get the following in YTuner logs:

```
$ sudo ./ytuner 
YTuner v1.2.6 Copyright (c) 2024 Greg P. (https://github.com/coffeegreg)
25-4-25 06:59:45 : Inf : Starting services...
25-4-25 06:59:45 : Inf : Successfully loaded 10 my stations.
25-4-25 06:59:45 : Dbg : Database library : 3.40.1.
25-4-25 06:59:45 : Inf : Checking local database.
25-4-25 06:59:45 : Inf : Local database is ready.
25-4-25 06:59:45 : Inf : DNS Service: listening on: 192.168.60.148:53.
25-4-25 06:59:45 : Inf : Web Service: listening on: 192.168.60.148:80.
25-4-25 06:59:46 : Dbg : DNS Query intercept : radioyamaha.vtuner.com.
25-4-25 06:59:46 : Dbg : GET /setupapp/Yamaha/asp/BrowseXML/loginXML.asp?token=0.
25-4-25 06:59:46 : Dbg : DNS Query intercept : radioyamaha2.vtuner.com.
25-4-25 06:59:46 : Dbg : GET /setupapp/Yamaha/asp/BrowseXML/loginXML.asp?token=0.
```

But on the RX-V2700 I still get the `Connection Error`.
Any ideas what I could try?

**Comment by TheBossME** [comment]
Have you changed your AVR from dhcp to,static ip and set dns to the ip address of the host running ytuner ?

**Comment by TheBossME** [comment]
Are you sure that you have both dns entries properly set ?

Please disconnect power cable for 2 minutes from your AVR

**Comment by coffeegreg** [comment]
@JSa1987 
It looks like wrong or empty gateway ... 🤔 
Show us your RX-V2700 network config:

- DHCP (off)
- Static IP Address
- Network Mask (255.255.255.0)
- Gateway
- Primary DNS
- Secondary DNS

What about you YTuner linux machine network config ? Show us `ifconfig` execute result log.
What is your `ytuner.ini` DNSServers setting? :
```
 ;DNS servers IP Addresses. Values must by comma separated. Default = 8.8.8.8,9.9.9.9 
 DNSServers=8.8.8.8,9.9.9.9 
```
Leave InterceptDNs with default:
```
InterceptDNs=*.vtuner.com
```
If you want to prevent unexpected auto upgrade of firmware of your device add `*yamaha.com` to InterceptDNs too. Read about this https://github.com/coffeegreg/YTuner/discussions/83

**Comment by TheBossME** [comment]
@coffeegreg thanks for always correcting me and picking up the users at a lower level. 
I just expect too much from most people.

**Comment by coffeegreg** [comment]
@TheBossME 
> if you're using software like pihole or adguard, you can dns masquerade it in pihole with adding this in Miscellaneous section.

He/she didn't. Looks like YTuner DNS Service works fine :
```
25-4-25 06:59:45 : Inf : DNS Service: listening on: 192.168.60.148:53.
25-4-25 06:59:46 : Dbg : DNS Query intercept : radioyamaha.vtuner.com.
```

**Comment by TheBossME** [comment]
@coffeegreg I mean this in relation to the possible use of Pihole or adguard to do the dns masking there, then you don't need to change anything on the AVR and everything fits then

**Comment by TheBossME** [comment]
@coffeegreg I mean this in relation to the possible use of Pihole or adguard to do the dns masking there, then you don't need to change anything on the AVR and everything fits then

**Comment by coffeegreg** [comment]
@TheBossME 
Life without YTuner is possible but useless ... 😆

**Comment by TheBossME** [comment]
> @TheBossME 
> Life without YTuner is possible but useless ... 😆 

at last !!! That's exactly the sentence I've been waiting for 👍👍💋

**Comment by JSa1987** [comment]
@TheBossME / @coffeegreg first of all thank you for the multiple prompt replies! 
I will try to answer all the questions above.

I have tried to disconnect the AVR for ~20min and plug it back in, no change.

The AVR is set to static IP (no DHCP) with the following configuration:
```
    DHCP >> OFF
    Static IP Address >> 192.168.60.2
    Network Mask >> 255.255.255.0
    Gateway >> 192.168.60.1
    Primary DNS >> 192.168.60.148
    Secondary DNS >> 192.168.60.148
```

Below is the network setup of the host running YTuner (Debian 12):
```
$ ip a s
1: lo: <LOOPBACK,UP,LOWER_UP> mtu 65536 qdisc noqueue state UNKNOWN group default qlen 1000
    link/loopback 00:00:00:00:00:00 brd 00:00:00:00:00:00
    inet 127.0.0.1/8 scope host lo
       valid_lft forever preferred_lft forever
    inet6 ::1/128 scope host noprefixroute 
       valid_lft forever preferred_lft forever
2: enp0s31f6: <NO-CARRIER,BROADCAST,MULTICAST,UP> mtu 1500 qdisc fq_codel state DOWN group default qlen 1000
    link/ether d4:81:d7:d8:b1:b0 brd ff:ff:ff:ff:ff:ff
3: wlp2s0: <BROADCAST,MULTICAST,UP,LOWER_UP> mtu 1500 qdisc noqueue state UP group default qlen 1000
    link/ether 14:ab:c5:a6:90:3c brd ff:ff:ff:ff:ff:ff
    inet 192.168.60.148/24 brd 192.168.60.255 scope global dynamic noprefixroute wlp2s0
       valid_lft 6291sec preferred_lft 6291sec
    inet6 fe80::bce9:b575:883d:ffaa/64 scope link noprefixroute 
       valid_lft forever preferred_lft forever
```

There is no firewall running on the host running YTuner blocking ports 53 and 80. And it seems that YTuner is receiving both DNS and HTTP requests:
```
25-4-25 12:57:46 : Dbg : DNS Query intercept : radioyamaha.vtuner.com.
25-4-25 12:57:46 : Dbg : GET /setupapp/Yamaha/asp/BrowseXML/loginXML.asp?token=0.
25-4-25 12:57:47 : Dbg : DNS Query intercept : radioyamaha2.vtuner.com.
25-4-25 12:57:47 : Dbg : GET /setupapp/Yamaha/asp/BrowseXML/loginXML.asp?token=0.
```

The configuration in `ytuner.ini` is the default one:
```
InterceptDNs=*.vtuner.com,*.radiosetup.com,*.my-noxon.net,*.radiomarantz.com
DNSServers=8.8.8.8,9.9.9.9
```

I see a similar issue is reported for the RX-V2700 and the RX-V3800 with YCast:
[Yamaha RX-V2700 & RX-V3800: "Connect error" #49](https://github.com/milaq/YCast/issues/49)
I first tried YCast and indeed had the same issue reported in the link above. I then switched to trying YTuner as it is actively developed/supported and mentioned it works with the RX-V3900 that is about from the same period (RX-V2700 is from 2007, the RX-V3800 is from 2008 and the RX-V3900 is from 2009).
[Ycast and Yamaha RX-V2065 #65](https://github.com/milaq/YCast/issues/65) mentions what seems to be a similar issue also with the RX-V2065 (that is from 2009, same year as the RX-V3900 that is reported as working with YTuner).

Maybe these older Yamaha receivers expect a slightly different response from vTuner/YCast/YTuner?

**Comment by TheBossME** [comment]
The RX-V3900 uses the same Firmware like my DSP-Z7. 
Hardware is also nearly similar.

Firmware version is 1.25 (which is the latest.

You could try the dns setting from Roland.
This works without installing ytuner in your local network.

**Comment by JSa1987** [comment]
@TheBossME i tried the DND setting from Ronald and I get the same issue.

The firmware I'm running is R061/L047/4.5r A006 5.6.21, that from the searches I have done on the internet should be the latest one.

**Comment by coffeegreg** [comment]
If this is indeed a problem related to the different communication method required by the RX-V2700, let's try to find out how your Yamaha is trying to talk to YTuner. 🤔 
Assuming that all network settings are OK and your AVR is communicating correctly with the YTuner DNS service on UDP/53 and the Web Service on port TCP/80, let's try to analyze the network traffic coming out of the AVR. 🚀 
If you are familiar with Wireshark or Termshark, try to capture all network traffic between the AVR (192.168.60.2) and the YTuner machine (192.168.60.148). At first, it can be just HTTP, but let's not limit ourselves to just TCP/80, but let's observe all TCP ports. Maybe the AVR wants to communicate with a different port on the YTuner side than TCP/80 ❓  🤔 
Or maybe it wants to communicate using TLS/SSL and uses TCP/443 or anything else ❓ 😮 
We can see in the logs that your AVR communicated with YTuner on port TCP/80:
```
25-4-25 06:59:46 : Dbg : GET /setupapp/Yamaha/asp/BrowseXML/loginXML.asp?token=0.
```
and should receive feedback with a token in the form:
```
<EncryptedToken>0123456789ABCDEF</EncryptedToken>
```
but without success because AVR tried again with another domain :
```
25-4-25 06:59:46 : Dbg : DNS Query intercept : radioyamaha2.vtuner.com.
25-4-25 06:59:46 : Dbg : GET /setupapp/Yamaha/asp/BrowseXML/loginXML.asp?token=0.
```
In the next step it should ask about the content of the main menu, but we do not observe this step in your logs...
🤔  ... or maybe your AVR wants to communicate by exchanging JSONs, not XMLs...
We will not be able to help you until you help yourself (and other RX-V2700 users) and catch network traffic frames between the AVR and the YTuner machine.

**Comment by TheBossME** [comment]
@JSa1987 that's Strange. Needs deep dive with termshark 
How good is your Linux knowledge ?

are you firm with termshark or tcpdump ?

**Comment by coffeegreg** [comment]
@JSa1987 
Beatrice @TheBossME is very helpful and together you can quickly find the cause 👍 
I prefer wireshark but in this case it doesn't matter and termshark can be used too. Initially I would skip checking UDP/53 and focus on TCP.

**Comment by JSa1987** [comment]
@coffeegreg  / @TheBossME hello,

I managed to capture some network traffic.

First I set the DNS on the AVR to 1.1.1.1 and 1.0.0.1 so that it would connect to VTuner and I captured the network traffic using the Packer Capture functionality of pfSense (I use pfSense as router). See the VTuner.pcap file attached.
[VTuner.zip](https://github.com/user-attachments/files/19920006/VTuner.zip)

Then I changed the DNS on the AVR back to 192.168.60.148 and 192.168.60.148 (the host running YTuner) and I captured the network traffic using Wireshark. See the YTuner file attached.
[YTuner.zip](https://github.com/user-attachments/files/19920005/YTuner.zip)

The difference I noticed in the responses to the AVR HTTP GET request `GET /setupapp/Yamaha/asp/BrowseXML/loginXML.asp?token=0 HTTP/1.1\r\n` is that VTuner seems to reply with one line of `text/html`:
```
Frame 9: 377 bytes on wire (3016 bits), 377 bytes captured (3016 bits)
Ethernet II, Src: ProxmoxS_4c:4f:bf (bc:24:11:4c:4f:bf), Dst: Yamaha_45:1d:80 (00:a0:de:45:1d:80)
Internet Protocol Version 4, Src: 23.238.115.210, Dst: 192.168.60.2
Transmission Control Protocol, Src Port: 80, Dst Port: 2048, Seq: 1, Ack: 168, Len: 311
Hypertext Transfer Protocol
Line-based text data: text/html (1 lines)
    <EncryptedToken>85d6fa40a9dcc906</EncryptedToken>

```

While YTuner seems to reply with three lines of `xml`:
```
Frame 13: 116 bytes on wire (928 bits), 116 bytes captured (928 bits)
Ethernet II, Src: IntelCor_a6:90:3c (14:ab:c5:a6:90:3c), Dst: Yamaha_45:1d:80 (00:a0:de:45:1d:80)
Internet Protocol Version 4, Src: 192.168.60.148, Dst: 192.168.60.2
Transmission Control Protocol, Src Port: 80, Dst Port: 2048, Seq: 109, Ack: 168, Len: 50
[2 Reassembled TCP Segments (158 bytes): #12(108), #13(50)]
Hypertext Transfer Protocol
eXtensible Markup Language
    <EncryptedToken>
        0123456789ABCDEF
        </EncryptedToken>
```

There is probably much more useful information that I did not notice in the captured network data... this is the first time to capture and analyze network data. :-)

**Comment by TheBossME** [comment]
@JSa1987 I was taken only a short look to your pcap file.

First: you requested a AAAA  dns resolution  with ipv6 protocol to radioyamaha.vtuner.com. Why do you do that ?
No old AVR does use ipv6. This is restricted to ipv4 only. please take a look to that.

Second: If you're using unbound as your local resolver on your Sense, it will be better to install ytuner directly on the Sense and using dnsmasq functionality and analyze with the packet tracer on the pfsense.

Third: Are you an IT guy ?, or why using Senses ?, and where are you located ?

**Comment by coffeegreg** [comment]
Good work @JSa1987 👍 
>is that VTuner seems to reply with one line 
>While YTuner seems to reply with three lines

Not really...  This is just a way of presenting it through Wireshark 😉 

You can check it with your web browser and URL : `http://192.168.60.148/setupapp/Yamaha/asp/BrowseXML/loginXML.asp?token=0`

But, the real reason may lie on :
>VTuner seems to reply with .... text/html:
> While YTuner seems to reply with ..... xml:

👀
I'm not sure if your device also wants to use the cookie values ... 🤔 
```
Set-Cookie: ASPSESSIONIDQAQTBRAR=DNJLEDIBDPMHIBJMHMPIFPOL
```
Let's check it out... 🤔 

Scenario 1: Try this YTuner 1.2.6 + Fix#120 linux x86_64 binary file:

[ytuner-1.2.6+Fix120-1-x86_64-linux.zip](https://github.com/user-attachments/files/19921667/ytuner-1.2.6%2BFix120-1-x86_64-linux.zip)

Scenario 2: Use new binary file + try to change `MyToken` from `ytuner.ini` file
to lowercase ... from: `MyToken=0123456789ABCDEF` to `MyToken=0123456789abcdef`

Scenario 3: Use new binary file + try to change `MyToken` from `ytuner.ini` file
to `85d6fa40a9dcc906` : `MyToken=85d6fa40a9dcc906`

Try each scenario separately and let us know about result...
Good luck 👍

**Comment by JSa1987** [comment]
@TheBossME I do not think the problem is related to DNS. The DNS request goes through the pfSense resolver only in the scenario where I was connecting to VTuner, connection that actually works. When I set the DNS on the AVR to the host running YTuner the DNS requests are successfully intercepted by YTuner.

@coffeegreg thank for looking into the captured network traffic and quickly providing a new binary.

I have tested all three scenarios you suggested and attached is the network captured data for all three scenarios. The practical outcome is still the same "Connection Error" on the AVR. But looking a the network captured data I think we are one step closer.

[Scenario1.zip](https://github.com/user-attachments/files/19922496/Scenario1.zip)
[Scenario2.zip](https://github.com/user-attachments/files/19922497/Scenario2.zip)
[Scenario3.zip](https://github.com/user-attachments/files/19922498/Scenario3.zip)

With the new binary provided the response that YTuner provides to the AVR HTTP GET request `GET /setupapp/Yamaha/asp/BrowseXML/loginXML.asp?token=0 HTTP/1.1\r\n` is:
```
Frame 13: 116 bytes on wire (928 bits), 116 bytes captured (928 bits)
Ethernet II, Src: IntelCor_a6:90:3c (14:ab:c5:a6:90:3c), Dst: Yamaha_45:1d:80 (00:a0:de:45:1d:80)
Internet Protocol Version 4, Src: 192.168.60.148, Dst: 192.168.60.2
Transmission Control Protocol, Src Port: 80, Dst Port: 2048, Seq: 113, Ack: 168, Len: 50
[2 Reassembled TCP Segments (162 bytes): #12(112), #13(50)]
Hypertext Transfer Protocol
    HTTP/1.1 200 OK\r\n
    Status: 200 OK\r\n
    Content-Length: 50\r\n
    Content-Type: text/html\r\n
    Server: YTuner/1.2.6+Fix#120#1\r\n
    \r\n
    [HTTP response 1/1]
    [Time since request: 0.001040000 seconds]
    [Request in frame: 10]
    [Request URI: http://radioyamaha.vtuner.com/setupapp/Yamaha/asp/BrowseXML/loginXML.asp?token=0]
    File Data: 50 bytes
Line-based text data: text/html (1 lines)
    <EncryptedToken>0123456789ABCDEF</EncryptedToken>\n
```

This is one line and regardless of the token value (default upper case, default lower case or `85d6fa40a9dcc906`) the RX-V2700 seems to like it because it moves on to the next GET request, as when connecting to VTuner.
Just one observation is that the response from the patched YTuner ends with `\n` while this is not there in the response from VTuner. But I do not think this bothers the RX-V2770.

In all three scenarios with the patched YTuner binary the RX-V2700 moves on to the next GET request `GET /setupapp/Yamaha/asp/BrowseXML/loginXML.asp?mac=7716ec807ffea27169f874a0b0299dec&dlang=eng&fver=M HTTP/1.1\r\n` and when receiving the YTuner reply to this request I get the "Connection Error" on the AVR.

Now I noticed that the reply to this request from YTuner includes the `ItemCount` element at the beginning while the one from VTuner does not.

YTuner response:
```
Frame 29: 955 bytes on wire (7640 bits), 955 bytes captured (7640 bits)
Ethernet II, Src: IntelCor_a6:90:3c (14:ab:c5:a6:90:3c), Dst: Yamaha_45:1d:80 (00:a0:de:45:1d:80)
Internet Protocol Version 4, Src: 192.168.60.148, Dst: 192.168.60.2
Transmission Control Protocol, Src Port: 80, Dst Port: 2051, Seq: 114, Ack: 214, Len: 889
[2 Reassembled TCP Segments (1002 bytes): #28(113), #29(889)]
Hypertext Transfer Protocol
    HTTP/1.1 200 OK\r\n
    Status: 200 OK\r\n
    Content-Length: 889\r\n
    Content-Type: text/html\r\n
    Server: YTuner/1.2.6+Fix#120#1\r\n
    \r\n
    [HTTP response 1/1]
    [Time since request: 0.001802000 seconds]
    [Request in frame: 26]
    [Request URI: http://radioyamaha.vtuner.com/setupapp/Yamaha/asp/BrowseXML/loginXML.asp?mac=a78533289339b61b50dd9e1ef692cec6&dlang=eng&fver=M]
    File Data: 889 bytes
eXtensible Markup Language
    <?xml
    <ListOfItems>
        <ItemCount>
            3
            </ItemCount>
        <Item>
            <ItemType>
                Dir
                </ItemType>
            <Title>
                Bookmarks
                </Title>
            <UrlDir>
                http://192.168.60.148/ytuner/bookmark?ytuner=true
                </UrlDir>
            <UrlDirBackUp>
                http://192.168.60.148/ytuner/bookmark?ytuner=true
                </UrlDirBackUp>
            <DirCount>
                0
                </DirCount>
            </Item>
        <Item>
            <ItemType>
                Dir
                </ItemType>
            <Title>
                My Favourites
                </Title>
            <UrlDir>
                http://192.168.60.148/ytuner/mystations?ytuner=true
                </UrlDir>
            <UrlDirBackUp>
                http://192.168.60.148/ytuner/mystations?ytuner=true
                </UrlDirBackUp>
            <DirCount>
                3
                </DirCount>
            </Item>
        <Item>
            <ItemType>
                Dir
                </ItemType>
            <Title>
                Radio Browser
                </Title>
            <UrlDir>
                http://192.168.60.148/ytuner/radiobrowser?ytuner=true
                </UrlDir>
            <UrlDirBackUp>
                http://192.168.60.148/ytuner/radiobrowser?ytuner=true
                </UrlDirBackUp>
            <DirCount>
                4
                </DirCount>
            </Item>
        </ListOfItems>
```

VTuner response:
```
Frame 22: 1513 bytes on wire (12104 bits), 1513 bytes captured (12104 bits)
Ethernet II, Src: ProxmoxS_4c:4f:bf (bc:24:11:4c:4f:bf), Dst: Yamaha_45:1d:80 (00:a0:de:45:1d:80)
Internet Protocol Version 4, Src: 23.238.115.210, Dst: 192.168.60.2
Transmission Control Protocol, Src Port: 80, Dst Port: 2051, Seq: 1449, Ack: 214, Len: 1447
[2 Reassembled TCP Segments (2895 bytes): #21(1448), #22(1447)]
Hypertext Transfer Protocol
    HTTP/1.1 200 OK\r\n
    Cache-Control: private\r\n
    Content-Type: text/html\r\n
    Server: Microsoft-IIS/10.0\r\n
    Set-Cookie: ASPSESSIONIDQAQTBRAR=PEKLEDIBHMFDMPICFLEMDLKK; path=/\r\n
    X-Powered-By: ASP.NET\r\n
    Date: Sat, 26 Apr 2025 02:27:25 GMT\r\n
    Connection: close\r\n
    Content-Length: 2631\r\n
    \r\n
    [HTTP response 1/1]
    [Time since request: 0.094934000 seconds]
    [Request in frame: 19]
    [Request URI: http://radioyamaha.vtuner.com/setupapp/Yamaha/asp/BrowseXML/loginXML.asp?mac=7716ec807ffea27169f874a0b0299dec&dlang=eng&fver=M]
    File Data: 2631 bytes
eXtensible Markup Language
    <?xml
    <ListOfItems>
        <Item>
            <ItemType>
                Dir
                </ItemType>
            <Title>
                Bookmarks
                </Title>
            <UrlDir>
                http://radioyamaha.vtuner.com/setupapp/yamaha/asp/browsexml/FavXML.asp?empty=
                </UrlDir>
            <UrlDirBackUp>
                http://radioyamaha2.vtuner.com/setupapp/yamaha/asp/browsexml/FavXML.asp?empty=
                </UrlDirBackUp>
            <DirCount>
                1
                </DirCount>
            </Item>
        <Item>
            <ItemType>
                Dir
                </ItemType>
            <Title>
                Locations
                </Title>
            <UrlDir>
                http://radioyamaha.vtuner.com/setupapp/yamaha/asp/BrowseXML/navXML.asp?gofile=LocationLevelTwo
                </UrlDir>
            <UrlDirBackUp>
                http://radioyamaha2.vtuner.com/setupapp/yamaha/asp/BrowseXML/navXML.asp?gofile=LocationLevelTwo
                </UrlDirBackUp>
            <DirCount>
                11
                </DirCount>
            </Item>
        <Item>
            <ItemType>
                Dir
                </ItemType>
            <Title>
                Genres
                </Title>
            <UrlDir>
                http://radioyamaha.vtuner.com/setupapp/yamaha/asp/BrowseXML/navXML.asp?gofile=GenreLevelTwo
                </UrlDir>
            <UrlDirBackUp>
                http://radioyamaha2.vtuner.com/setupapp/yamaha/asp/BrowseXML/navXML.asp?gofile=GenreLevelTwo
                </UrlDirBackUp>
            <DirCount>
                54
                </DirCount>
            </Item>
        <Item>
            <ItemType>
                Dir
                </ItemType>
            <Title>
                New Stations
                </Title>
            <UrlDir>
                http://radioyamaha.vtuner.com/setupapp/yamaha/asp/BrowseXML/navXML.asp?gofile=NewStation
                </UrlDir>
            <UrlDirBackUp>
                http://radioyamaha2.vtuner.com/setupapp/yamaha/asp/BrowseXML/navXML.asp?gofile=NewStation
                </UrlDirBackUp>
            <DirCount>
                3231
                </DirCount>
            </Item>
        <Item>
            <ItemType>
                Dir
                </ItemType>
            <Title>
                Popular Stations
                </Title>
            <UrlDir>
                http://radioyamaha.vtuner.com/setupapp/yamaha/asp/BrowseXML/navXML.asp?gofile=MostPopStations
                </UrlDir>
            <UrlDirBackUp>
                http://radioyamaha2.vtuner.com/setupapp/yamaha/asp/BrowseXML/navXML.asp?gofile=MostPopStations
                </UrlDirBackUp>
            <DirCount>
                100
                </DirCount>
            </Item>
        <Item>
            <ItemType>
                Dir
                </ItemType>
            <Title>
                Podcasts
                </Title>
            <UrlDir>
                http://radioyamaha.vtuner.com/setupapp/yamaha/asp/BrowseXML/navXML.asp?gofile=P-Podcasts
                </UrlDir>
            <UrlDirBackUp>
                http://radioyamaha2.vtuner.com/setupapp/yamaha/asp/BrowseXML/navXML.asp?gofile=P-Podcasts
                </UrlDirBackUp>
            <DirCount>
                2
                </DirCount>
            </Item>
        <Item>
            <ItemType>
                Dir
                </ItemType>
            <Title>
                Help
                </Title>
            <UrlDir>
                http://radioyamaha.vtuner.com/setupapp/yamaha/asp/BrowseXML/navXML.asp?gofile=Help
                </UrlDir>
            <UrlDirBackUp>
                http://radioyamaha2.vtuner.com/setupapp/yamaha/asp/BrowseXML/navXML.asp?gofile=Help
                </UrlDirBackUp>
            <DirCount>
                3
                </DirCount>
            </Item>
        <Item>
            <ItemType>
                Dir
                </ItemType>
            <Title>
                Get Access Code
                </Title>
            <UrlDir>
                http://radioyamaha.vtuner.com/setupapp/yamaha/asp/BrowseXML/register.asp?gofile=
                </UrlDir>
            <UrlDirBackUp>
                http://radioyamaha2.vtuner.com/setupapp/yamaha/asp/BrowseXML/register.asp?gofile=
                </UrlDirBackUp>
            <DirCount>
                1
                </DirCount>
            </Item>
        </ListOfItems>
```

[VTuner.zip](https://github.com/user-attachments/files/19922506/VTuner.zip)

Could the presence of the `ItemCount` element in the YTuner response be what causes the new problem?

**Comment by coffeegreg** [comment]
@JSa1987 
Good analysis 👍 
Let's see what happens if we temporarily remove the `ItemCount` element from XML ... 🤔 
Try this one :

[ytuner-1.2.6+Fix120-2-x86_64-linux.zip](https://github.com/user-attachments/files/19924529/ytuner-1.2.6%2BFix120-2-x86_64-linux.zip)

**Comment by coffeegreg** [comment]
@JSa1987 
If you still have access to vTuner, use it and try to capture all HTTP network traffic related to each operation on your AVR. Go to each menu/submenu item and select each option so that a trace of this actions remain in the pcap file. This can be very, very useful in the future and may allow us to discover other options that YTuner does not support, e.g. `Podcasts`, `Help` at this moment. 🚀

**Comment by JSa1987** [comment]
> ytuner-1.2.6+Fix120-2-x86_64-linux.zip

@coffeegreg THANK YOU! This patched version works with the Yamaha RX-V2700!

When accessing the Net Radio on the AVR I now successfully get a main menu with:

1.  Bookmarks
2. My Favorites
3. Radio Browser

From "My Favorites" I can browse and successfully play all the radio stations listed in the `station.yaml` file. 
From "Radio Browser" I can browse all the categories and sub categories and I am able to play the radio stations.

When trying to access the "Bookmark" menu item is get a connection error, but I believe this is because I do not have bookmarks defined yet. I see YTuner replies with a `404 Not Found`.

```
Frame 23: 184 bytes on wire (1472 bits), 184 bytes captured (1472 bits)
Ethernet II, Src: IntelCor_a6:90:3c (14:ab:c5:a6:90:3c), Dst: Yamaha_45:1d:80 (00:a0:de:45:1d:80)
Internet Protocol Version 4, Src: 192.168.60.148, Dst: 192.168.60.2
Transmission Control Protocol, Src Port: 80, Dst Port: 2175, Seq: 1, Ack: 202, Len: 118
Hypertext Transfer Protocol
    HTTP/1.1 404 Not Found\r\n
    Status: 404 OK\r\n
    Content-Length: 0\r\n
    Content-Type: text/html\r\n
    Server: YTuner/1.2.6+Fix#120#2\r\n
    \r\n
    [HTTP response 1/1]
    [Time since request: 0.000864000 seconds]
    [Request in frame: 21]
    [Request URI: http://192.168.60.148/ytuner/bookmark?ytuner=true&mac=7716ec807ffea27169f874a0b0299dec&dlang=eng&start=1&howmany=8]
```

**Comment by coffeegreg** [comment]
@JSa1987 
I'm glad to know that YTuner works with your AVR too 👍 

> From "My Favorites" I can browse and successfully play all the radio stations listed in the station.yaml file.

... or from `stations.ini` as default.

> When trying to access the "Bookmark" menu item is get a connection error, but I believe this is because I do not have bookmarks defined yet.

Exactly ❗ 👍 Make sure your device supports bookmarks though. Not all of them do.
I'm going to add new parameters to `avr.ini` for YTuner v2.x.x to enable proper communication of YTuner with devices such as Yamaha RX-V2700 and others similar. 🚀 Until then, use these temporary binaries.
Make a little more effort and help us better support our devices. As I wrote earlier, if you still have access to vTuner, try to catch the network traffic associated with each action on AVR and the response that vTuner returns. This would be very helpful in further development and improvement of YTuner. 👍

**Comment by JSa1987** [comment]
@coffeegreg I do not have full access to vTuner.
If I use normal DNS servers and connect to vTuner from the AVR I get the first menu, but then regardless of which option I select in the first menu I get one station listed that say I need to buy a subscription.
I'm not sure if the network traffic associated with browsing this first menu would be of any help. If so, let me know and I can work on capturing it.

**Comment by coffeegreg** [comment]
Closing as resolved.
I'm going to add Yamaha RX-V2700 to the "Confirmed working" list with YTuner v2.0.0 release.
